{
  "experiment_id": "msasl50_baseline_seed42",
  "title": "MS-ASL50 baseline (seed 42)",
  "date": "2026-04-21T10:21:33.194941+00:00",
  "owner": "Francisco Sandoval",
  "git_commit": "4490647",
  "research_question": "Does the same GRU+Attention pipeline that achieves competitive results on WLASL30 generalize to a second ASL dataset (MS-ASL) with 50 classes and different video characteristics (multi-signer, YouTube-sourced)?\n",
  "dataset": "msasl50",
  "dataset_version_or_path": "",
  "split_strategy": "train/val/test",
  "num_classes": 0,
  "num_samples_train": 1410,
  "num_samples_val": 306,
  "num_samples_test": 236,
  "input_representation": "MediaPipe hand landmarks",
  "preprocessing": [
    "wrist-centered normalization",
    "wrist-to-middle-finger scale",
    "linear interpolation for missing frames",
    "pad/truncate to 64 frames"
  ],
  "model_architecture": "gru_attention",
  "model_config": {
    "name": "gru_attention",
    "hidden_size": 256,
    "num_layers": 2,
    "dropout": 0.4,
    "bidirectional": true
  },
  "training_config": {
    "seed": 42,
    "batch_size": 32,
    "epochs": 150,
    "lr": 0.001,
    "weight_decay": 0.0005,
    "label_smoothing": 0.1,
    "patience": 30
  },
  "seed": 42,
  "hardware": {
    "gpu": "NVIDIA GeForce RTX 3050 Ti Laptop GPU",
    "torch_version": "2.9.1+cu128",
    "python_version": "3.10.14",
    "platform": "Linux-6.17.0-20-generic-x86_64-with-glibc2.39"
  },
  "runtime": {
    "training_time_s": 165.5,
    "total_epochs": 85,
    "best_epoch": 55
  },
  "max_frames": 64,
  "num_hands": 1,
  "landmark_features": 63,
  "normalization_strategy": "wrist-centered, wrist-to-middle-finger scale",
  "detection_rate_mean": null,
  "detection_rate_by_split": {
    "train": null,
    "val": null,
    "test": null
  },
  "interpolation_strategy": "linear interpolation with edge fill",
  "top1": 66.95,
  "top5": 89.83,
  "macro_f1": 64.22,
  "balanced_accuracy": 66.34,
  "metrics": {
    "val_top1": 70.58823529411765,
    "top1_acc": 66.95,
    "top5_acc": 89.83,
    "macro_f1": 64.22,
    "balanced_accuracy": 66.34,
    "num_samples": 236,
    "num_classes": 50
  },
  "artifacts": {
    "checkpoint": "05_experiments/msasl50_baseline/seed42/best_model.pt",
    "training_curves": "05_experiments/msasl50_baseline/seed42/training_curves.png",
    "training_history": "05_experiments/msasl50_baseline/seed42/training_history.json",
    "confusion_matrix": "05_experiments/msasl50_baseline/seed42/confusion_matrix_normalized_true.png",
    "per_class_metrics": "05_experiments/msasl50_baseline/seed42/per_class_metrics.csv",
    "manifest": "05_experiments/msasl50_baseline/seed42/experiment_manifest.json"
  },
  "confusion_matrix_path": "05_experiments/msasl50_baseline/seed42/confusion_matrix_normalized_true.png",
  "per_class_accuracy_path": "05_experiments/msasl50_baseline/seed42/per_class_metrics.csv",
  "main_findings": [],
  "limitations": [],
  "next_actions": []
}
