{
  "experiment_id": "wlasl30_seed42_frames32",
  "title": "Sequence length sweep - 32 frames",
  "date": "2026-04-18T23:26:01.606627+00:00",
  "owner": "Francisco Sandoval",
  "git_commit": "8078f76",
  "research_question": "Does reducing sequence length from 64 to 32 frames affect WLASL30 recognition accuracy under the same GRU+Attention architecture?\n",
  "dataset": "wlasl30",
  "dataset_version_or_path": "",
  "split_strategy": "train/val/test",
  "num_classes": 0,
  "num_samples_train": 242,
  "num_samples_val": 56,
  "num_samples_test": 34,
  "input_representation": "MediaPipe hand landmarks",
  "preprocessing": [
    "wrist-centered normalization",
    "wrist-to-middle-finger scale",
    "linear interpolation for missing frames",
    "pad/truncate to 32 frames"
  ],
  "model_architecture": "gru_attention",
  "model_config": {
    "name": "gru_attention",
    "hidden_size": 256,
    "num_layers": 2,
    "dropout": 0.4,
    "bidirectional": true
  },
  "training_config": {
    "seed": 42,
    "batch_size": 32,
    "epochs": 150,
    "lr": 0.001,
    "weight_decay": 0.0005,
    "label_smoothing": 0.1,
    "patience": 30
  },
  "seed": 42,
  "hardware": {
    "gpu": "NVIDIA GeForce RTX 3050 Ti Laptop GPU",
    "torch_version": "2.9.1+cu128",
    "python_version": "3.10.14",
    "platform": "Linux-6.17.0-20-generic-x86_64-with-glibc2.39"
  },
  "runtime": {
    "training_time_s": 10.4,
    "total_epochs": 88,
    "best_epoch": 58
  },
  "max_frames": 32,
  "num_hands": 1,
  "landmark_features": 63,
  "normalization_strategy": "wrist-centered, wrist-to-middle-finger scale",
  "detection_rate_mean": null,
  "detection_rate_by_split": {
    "train": null,
    "val": null,
    "test": null
  },
  "interpolation_strategy": "linear interpolation with edge fill",
  "top1": 61.76,
  "top5": 88.24,
  "macro_f1": 55.77,
  "balanced_accuracy": 69.7,
  "metrics": {
    "val_top1": 66.07142857142857,
    "top1_acc": 61.76,
    "top5_acc": 88.24,
    "macro_f1": 55.77,
    "balanced_accuracy": 69.7,
    "num_samples": 34,
    "num_classes": 30
  },
  "artifacts": {
    "checkpoint": "05_experiments/sequence_length_sweep/wlasl30_seed42_frames32/best_model.pt",
    "training_curves": "05_experiments/sequence_length_sweep/wlasl30_seed42_frames32/training_curves.png",
    "training_history": "05_experiments/sequence_length_sweep/wlasl30_seed42_frames32/training_history.json",
    "confusion_matrix": "05_experiments/sequence_length_sweep/wlasl30_seed42_frames32/confusion_matrix_normalized_true.png",
    "per_class_metrics": "05_experiments/sequence_length_sweep/wlasl30_seed42_frames32/per_class_metrics.csv",
    "manifest": "05_experiments/sequence_length_sweep/wlasl30_seed42_frames32/experiment_manifest.json"
  },
  "confusion_matrix_path": "05_experiments/sequence_length_sweep/wlasl30_seed42_frames32/confusion_matrix_normalized_true.png",
  "per_class_accuracy_path": "05_experiments/sequence_length_sweep/wlasl30_seed42_frames32/per_class_metrics.csv",
  "main_findings": [
    "Top-1 61.76% is the highest of the three seed=42 runs (64f: 55.88%, 96f: 58.82%), but the margin is within the documented K-Fold Top-1 standard deviation of +/-4.5%, so this single-seed result cannot be read as evidence that shorter sequences help.",
    "Top-5 88.24% is comparable to the 96f run (85.29%) and clearly above the 64f run (73.53%), again pointing to seed-level variance on the 34-sample test set rather than a length effect.",
    "Training ran for 88 epochs with early stopping triggering at epoch 58, the longest of the three lengths; 32-frame inputs did not converge faster despite carrying less temporal information.",
    "Val Top-1 is 66.07%, identical to the 64f seed=42 run, suggesting the Top-1 gap is localised to the test split."
  ],
  "limitations": [
    "Single seed (42); no statistical significance can be claimed against the 64f or 96f runs.",
    "Test set has only 34 samples, so each misclassification shifts Top-1 by ~2.94 percentage points.",
    "Early stopping with patience=30 may interact differently with shorter sequences, but this cannot be diagnosed from a single run."
  ],
  "next_actions": [
    "Re-run with seeds 123 and 2026 and report mean +/- std before drawing any conclusion about 32 vs 64 frames.",
    "After multi-seed aggregation, inspect the per-class confusion matrix to check whether short sequences preferentially hurt signs with long duration."
  ]
}
