{
  "experiment_id": "wlasl30_seed42_frames64",
  "title": "Sequence length sweep - 64 frames",
  "date": "2026-04-18T23:27:38.105852+00:00",
  "owner": "Francisco Sandoval",
  "git_commit": "8078f76",
  "research_question": "Baseline comparison point for the sequence length sweep. 64 frames is the current default.\n",
  "dataset": "wlasl30",
  "dataset_version_or_path": "",
  "split_strategy": "train/val/test",
  "num_classes": 0,
  "num_samples_train": 242,
  "num_samples_val": 56,
  "num_samples_test": 34,
  "input_representation": "MediaPipe hand landmarks",
  "preprocessing": [
    "wrist-centered normalization",
    "wrist-to-middle-finger scale",
    "linear interpolation for missing frames",
    "pad/truncate to 64 frames"
  ],
  "model_architecture": "gru_attention",
  "model_config": {
    "name": "gru_attention",
    "hidden_size": 256,
    "num_layers": 2,
    "dropout": 0.4,
    "bidirectional": true
  },
  "training_config": {
    "seed": 42,
    "batch_size": 32,
    "epochs": 150,
    "lr": 0.001,
    "weight_decay": 0.0005,
    "label_smoothing": 0.1,
    "patience": 30
  },
  "seed": 42,
  "hardware": {
    "gpu": "NVIDIA GeForce RTX 3050 Ti Laptop GPU",
    "torch_version": "2.9.1+cu128",
    "python_version": "3.10.14",
    "platform": "Linux-6.17.0-20-generic-x86_64-with-glibc2.39"
  },
  "runtime": {
    "training_time_s": 11.2,
    "total_epochs": 70,
    "best_epoch": 40
  },
  "max_frames": 64,
  "num_hands": 1,
  "landmark_features": 63,
  "normalization_strategy": "wrist-centered, wrist-to-middle-finger scale",
  "detection_rate_mean": null,
  "detection_rate_by_split": {
    "train": null,
    "val": null,
    "test": null
  },
  "interpolation_strategy": "linear interpolation with edge fill",
  "top1": 55.88,
  "top5": 73.53,
  "macro_f1": 55.94,
  "balanced_accuracy": 68.18,
  "metrics": {
    "val_top1": 66.07142857142857,
    "top1_acc": 55.88,
    "top5_acc": 73.53,
    "macro_f1": 55.94,
    "balanced_accuracy": 68.18,
    "num_samples": 34,
    "num_classes": 30
  },
  "artifacts": {
    "checkpoint": "05_experiments/sequence_length_sweep/wlasl30_seed42_frames64/best_model.pt",
    "training_curves": "05_experiments/sequence_length_sweep/wlasl30_seed42_frames64/training_curves.png",
    "training_history": "05_experiments/sequence_length_sweep/wlasl30_seed42_frames64/training_history.json",
    "confusion_matrix": "05_experiments/sequence_length_sweep/wlasl30_seed42_frames64/confusion_matrix_normalized_true.png",
    "per_class_metrics": "05_experiments/sequence_length_sweep/wlasl30_seed42_frames64/per_class_metrics.csv",
    "manifest": "05_experiments/sequence_length_sweep/wlasl30_seed42_frames64/experiment_manifest.json"
  },
  "confusion_matrix_path": "05_experiments/sequence_length_sweep/wlasl30_seed42_frames64/confusion_matrix_normalized_true.png",
  "per_class_accuracy_path": "05_experiments/sequence_length_sweep/wlasl30_seed42_frames64/per_class_metrics.csv",
  "main_findings": [
    "Top-1 55.88% is the lowest of the three seed=42 runs (32f: 61.76%, 96f: 58.82%) and ~3 pp below the 58.8% reported by notebook 11 for the same architecture and split, which is consistent with seed-level test variance on 34 samples rather than a regression introduced by the refactor.",
    "Val Top-1 66.07% matches the 32f run exactly, so the delta between the two lengths lives entirely on the test split.",
    "Convergence at epoch 40 and early stopping at epoch 70 places this run in the middle of the three lengths in terms of total training time."
  ],
  "limitations": [
    "Single seed (42) makes the 64f baseline noisy; the 55.88% number should not be used as the reference point against which 32f and 96f are compared.",
    "Test set has only 34 samples; single misclassifications move Top-1 by ~2.94 percentage points."
  ],
  "next_actions": [
    "Re-run with seeds 123 and 2026 to establish a stable 64f baseline and confirm the refactored pipeline reproduces the notebook-11 result on average.",
    "Once the multi-seed mean is available, rebuild the sweep plot and update the SOTA comparison table in the report with mean +/- std."
  ]
}
